{
  "at": "2026-10-06T00:02:00Z",
  "by": {
    "id": "max",
    "kind": "person"
  },
  "contract": "stepmeld/history.v1",
  "detail": {
    "outputs": {
      "notes": "notes-1"
    }
  },
  "kind": "completed",
  "run": "report-1/notes/1",
  "seq": 3,
  "step": "notes",
  "workflow": "report-1"
}
